{
  "schema_version": 2,
  "project_id": "unsafe-project",
  "project_type": "node-app",
  "detected_stack": [
    { "language": "typescript", "percentage": 100 }
  ],
  "commands": {
    "safe": {
      "build": [],
      "test": []
    },
    "ambiguous": [],
    "unsafe": [
      { "id": "deploy", "command": "npm run deploy", "source": "package.json" }
    ]
  },
  "risk_profile": {
    "risk_level": "medium",
    "reasons": ["deployment scripts are present"]
  },
  "scan_summary": {
    "total_files": 12,
    "lines_of_code": 900
  }
}
